[
  {
    "id": "crowd-mode.major",
    "set": "crowd-mode",
    "claim": "Share of the 79,149 crowd-labelled keys in major.",
    "share": 51.1,
    "count": null,
    "total": null,
    "source": ["crowd-tabs"],
    "tag": "derived"
  },
  {
    "id": "crowd-mode.minor",
    "set": "crowd-mode",
    "claim": "Share of the 79,149 crowd-labelled keys in natural minor.",
    "share": 36.6,
    "count": null,
    "total": null,
    "source": ["crowd-tabs"],
    "tag": "derived"
  },
  {
    "id": "crowd-mode.mixolydian",
    "set": "crowd-mode",
    "claim": "Share of the 79,149 crowd-labelled keys in Mixolydian.",
    "share": 5.6,
    "count": null,
    "total": null,
    "source": ["crowd-tabs"],
    "tag": "derived"
  },
  {
    "id": "crowd-mode.dorian",
    "set": "crowd-mode",
    "claim": "Share of the 79,149 crowd-labelled keys in Dorian.",
    "share": 4.4,
    "count": null,
    "total": null,
    "source": ["crowd-tabs"],
    "tag": "derived"
  },
  {
    "id": "crowd-mode.phrygian",
    "set": "crowd-mode",
    "claim": "Share of the 79,149 crowd-labelled keys in Phrygian.",
    "share": 1.3,
    "count": null,
    "total": null,
    "source": ["crowd-tabs"],
    "tag": "derived"
  },
  {
    "id": "crowd-mode.lydian",
    "set": "crowd-mode",
    "claim": "Share of the 79,149 crowd-labelled keys in Lydian.",
    "share": 0.8,
    "count": null,
    "total": null,
    "source": ["crowd-tabs"],
    "tag": "derived"
  },
  {
    "id": "crowd-mode.locrian",
    "set": "crowd-mode",
    "claim": "Share of the 79,149 crowd-labelled keys in Locrian.",
    "share": 0.2,
    "count": null,
    "total": null,
    "source": ["crowd-tabs"],
    "tag": "derived"
  },
  {
    "id": "crowd-major-root.c",
    "set": "crowd-major-root",
    "claim": "Share of crowd-labelled major keys with tonic C.",
    "share": 15,
    "count": null,
    "total": null,
    "source": ["crowd-tabs"],
    "tag": "derived"
  },
  {
    "id": "crowd-major-root.d",
    "set": "crowd-major-root",
    "claim": "Share of crowd-labelled major keys with tonic D.",
    "share": 12,
    "count": null,
    "total": null,
    "source": ["crowd-tabs"],
    "tag": "derived"
  },
  {
    "id": "crowd-major-root.g",
    "set": "crowd-major-root",
    "claim": "Share of crowd-labelled major keys with tonic G.",
    "share": 12,
    "count": null,
    "total": null,
    "source": ["crowd-tabs"],
    "tag": "derived"
  },
  {
    "id": "crowd-major-root.a",
    "set": "crowd-major-root",
    "claim": "Share of crowd-labelled major keys with tonic A.",
    "share": 10,
    "count": null,
    "total": null,
    "source": ["crowd-tabs"],
    "tag": "derived"
  },
  {
    "id": "crowd-major-root.e",
    "set": "crowd-major-root",
    "claim": "Share of crowd-labelled major keys with tonic E.",
    "share": 9,
    "count": null,
    "total": null,
    "source": ["crowd-tabs"],
    "tag": "derived"
  },
  {
    "id": "crowd-major-root.f",
    "set": "crowd-major-root",
    "claim": "Share of crowd-labelled major keys with tonic F.",
    "share": 8,
    "count": null,
    "total": null,
    "source": ["crowd-tabs"],
    "tag": "derived"
  },
  {
    "id": "crowd-minor-root.a",
    "set": "crowd-minor-root",
    "claim": "Share of crowd-labelled minor keys with tonic A.",
    "share": 13,
    "count": null,
    "total": null,
    "source": ["crowd-tabs"],
    "tag": "derived"
  },
  {
    "id": "crowd-minor-root.c",
    "set": "crowd-minor-root",
    "claim": "Share of crowd-labelled minor keys with tonic C.",
    "share": 12,
    "count": null,
    "total": null,
    "source": ["crowd-tabs"],
    "tag": "derived"
  },
  {
    "id": "crowd-minor-root.e",
    "set": "crowd-minor-root",
    "claim": "Share of crowd-labelled minor keys with tonic E.",
    "share": 12,
    "count": null,
    "total": null,
    "source": ["crowd-tabs"],
    "tag": "derived"
  },
  {
    "id": "crowd-minor-root.d",
    "set": "crowd-minor-root",
    "claim": "Share of crowd-labelled minor keys with tonic D.",
    "share": 11,
    "count": null,
    "total": null,
    "source": ["crowd-tabs"],
    "tag": "derived"
  },
  {
    "id": "crowd-minor-root.b",
    "set": "crowd-minor-root",
    "claim": "Share of crowd-labelled minor keys with tonic B.",
    "share": 9,
    "count": null,
    "total": null,
    "source": ["crowd-tabs"],
    "tag": "derived"
  },
  {
    "id": "crowd-minor-root.g",
    "set": "crowd-minor-root",
    "claim": "Share of crowd-labelled minor keys with tonic G.",
    "share": 8,
    "count": null,
    "total": null,
    "source": ["crowd-tabs"],
    "tag": "derived"
  },
  {
    "id": "relative-minor-root.set1-c",
    "set": "relative-minor-root-set1",
    "claim": "Share of tracks in the 604-track annotated set whose relative-minor root is C.",
    "share": 10.3,
    "count": null,
    "total": null,
    "source": ["key-set-1"],
    "tag": "derived"
  },
  {
    "id": "relative-minor-root.set1-c-sharp",
    "set": "relative-minor-root-set1",
    "claim": "Share of tracks in the 604-track annotated set whose relative-minor root is C#.",
    "share": 5.8,
    "count": null,
    "total": null,
    "source": ["key-set-1"],
    "tag": "derived"
  },
  {
    "id": "relative-minor-root.set1-d",
    "set": "relative-minor-root-set1",
    "claim": "Share of tracks in the 604-track annotated set whose relative-minor root is D.",
    "share": 8.1,
    "count": null,
    "total": null,
    "source": ["key-set-1"],
    "tag": "derived"
  },
  {
    "id": "relative-minor-root.set1-d-sharp",
    "set": "relative-minor-root-set1",
    "claim": "Share of tracks in the 604-track annotated set whose relative-minor root is D#.",
    "share": 6.8,
    "count": null,
    "total": null,
    "source": ["key-set-1"],
    "tag": "derived"
  },
  {
    "id": "relative-minor-root.set1-e",
    "set": "relative-minor-root-set1",
    "claim": "Share of tracks in the 604-track annotated set whose relative-minor root is E.",
    "share": 9.3,
    "count": null,
    "total": null,
    "source": ["key-set-1"],
    "tag": "derived"
  },
  {
    "id": "relative-minor-root.set1-f",
    "set": "relative-minor-root-set1",
    "claim": "Share of tracks in the 604-track annotated set whose relative-minor root is F.",
    "share": 12.9,
    "count": null,
    "total": null,
    "source": ["key-set-1"],
    "tag": "derived"
  },
  {
    "id": "relative-minor-root.set1-f-sharp",
    "set": "relative-minor-root-set1",
    "claim": "Share of tracks in the 604-track annotated set whose relative-minor root is F#.",
    "share": 7.0,
    "count": null,
    "total": null,
    "source": ["key-set-1"],
    "tag": "derived"
  },
  {
    "id": "relative-minor-root.set1-g",
    "set": "relative-minor-root-set1",
    "claim": "Share of tracks in the 604-track annotated set whose relative-minor root is G.",
    "share": 11.1,
    "count": null,
    "total": null,
    "source": ["key-set-1"],
    "tag": "derived"
  },
  {
    "id": "relative-minor-root.set1-g-sharp",
    "set": "relative-minor-root-set1",
    "claim": "Share of tracks in the 604-track annotated set whose relative-minor root is G#.",
    "share": 5.6,
    "count": null,
    "total": null,
    "source": ["key-set-1"],
    "tag": "derived"
  },
  {
    "id": "relative-minor-root.set1-a",
    "set": "relative-minor-root-set1",
    "claim": "Share of tracks in the 604-track annotated set whose relative-minor root is A.",
    "share": 11.4,
    "count": null,
    "total": null,
    "source": ["key-set-1"],
    "tag": "derived"
  },
  {
    "id": "relative-minor-root.set1-a-sharp",
    "set": "relative-minor-root-set1",
    "claim": "Share of tracks in the 604-track annotated set whose relative-minor root is A#.",
    "share": 4.8,
    "count": null,
    "total": null,
    "source": ["key-set-1"],
    "tag": "derived"
  },
  {
    "id": "relative-minor-root.set1-b",
    "set": "relative-minor-root-set1",
    "claim": "Share of tracks in the 604-track annotated set whose relative-minor root is B.",
    "share": 7.0,
    "count": null,
    "total": null,
    "source": ["key-set-1"],
    "tag": "derived"
  },
  {
    "id": "minor-share.set1",
    "set": null,
    "claim": "Share of tracks in the 604-track annotated set that are minor.",
    "share": 84.6,
    "count": null,
    "total": null,
    "source": ["key-set-1"],
    "tag": "derived"
  },
  {
    "id": "relative-minor-root.set2-c",
    "set": "relative-minor-root-set2",
    "claim": "Share of tracks in the 1,350-track annotated set whose relative-minor root is C.",
    "share": 11.7,
    "count": null,
    "total": null,
    "source": ["key-set-2"],
    "tag": "derived"
  },
  {
    "id": "relative-minor-root.set2-c-sharp",
    "set": "relative-minor-root-set2",
    "claim": "Share of tracks in the 1,350-track annotated set whose relative-minor root is C#.",
    "share": 8.7,
    "count": null,
    "total": null,
    "source": ["key-set-2"],
    "tag": "derived"
  },
  {
    "id": "relative-minor-root.set2-d",
    "set": "relative-minor-root-set2",
    "claim": "Share of tracks in the 1,350-track annotated set whose relative-minor root is D.",
    "share": 8.7,
    "count": null,
    "total": null,
    "source": ["key-set-2"],
    "tag": "derived"
  },
  {
    "id": "relative-minor-root.set2-d-sharp",
    "set": "relative-minor-root-set2",
    "claim": "Share of tracks in the 1,350-track annotated set whose relative-minor root is D#.",
    "share": 6.4,
    "count": null,
    "total": null,
    "source": ["key-set-2"],
    "tag": "derived"
  },
  {
    "id": "relative-minor-root.set2-e",
    "set": "relative-minor-root-set2",
    "claim": "Share of tracks in the 1,350-track annotated set whose relative-minor root is E.",
    "share": 9.9,
    "count": null,
    "total": null,
    "source": ["key-set-2"],
    "tag": "derived"
  },
  {
    "id": "relative-minor-root.set2-f",
    "set": "relative-minor-root-set2",